{
  "$schema": "https://json-schema.org/draft/2020-12/schema",
  "$id": "https://simplevtt.local/schemas/content-entry.schema.json",
  "title": "SimpleVTT Content Entry",
  "type": "object",
  "required": ["id", "category", "presentation"],
  "properties": {
    "id": {"type": "string", "pattern": "^[a-z0-9][a-z0-9._-]*$"},
    "category": {"type": "string", "minLength": 1},
    "presentation": {"$ref": "https://simplevtt.local/schemas/localized-presentation.schema.json"},
    "tags": {"type": "array", "uniqueItems": true, "items": {"type": "string", "minLength": 1}},
    "requiresCapabilities": {"type": "array", "uniqueItems": true, "items": {"type": "string", "minLength": 1}},
    "relationships": {"type": "array", "items": {"$ref": "#/$defs/relationship"}},
    "extensionPoints": {"type": "array", "items": {"$ref": "#/$defs/extensionPoint"}},
    "progressionContributions": {"type": "array", "items": {"$ref": "#/$defs/progressionContribution"}},
    "mechanics": {"type": "array", "items": {"$ref": "#/$defs/mechanicEnvelope"}},
    "$schema": {"type": "string", "format": "uri"}
  },
  "additionalProperties": false,
  "$defs": {
    "relationship": {"type": "object", "required": ["kind", "target"], "properties": {"kind": {"enum": ["parent", "extends", "replaces"]}, "target": {"type": "string", "minLength": 1}, "extensionPoint": {"type": "string", "minLength": 1}, "targetVersion": {"type": "string", "minLength": 1}}, "additionalProperties": false},
    "extensionPoint": {"type": "object", "required": ["id", "acceptsCategories"], "properties": {"id": {"type": "string", "minLength": 1}, "acceptsCategories": {"type": "array", "minItems": 1, "uniqueItems": true, "items": {"type": "string", "minLength": 1}}}, "additionalProperties": false},
    "progressionContribution": {"type": "object", "required": ["track", "threshold", "grants"], "properties": {"track": {"type": "string", "minLength": 1}, "threshold": {"type": "integer", "minimum": 0}, "grants": {"type": "array", "minItems": 1, "uniqueItems": true, "items": {"type": "string", "minLength": 1}}, "choices": {"type": "array", "items": {"$ref": "#/$defs/progressionChoice"}}}, "additionalProperties": false},
    "progressionChoice": {"type": "object", "required": ["id", "label", "count", "required", "options"], "properties": {"id": {"type": "string", "minLength": 1}, "label": {"type": "string", "minLength": 1}, "description": {"type": "string"}, "count": {"type": "integer", "minimum": 1}, "required": {"type": "boolean"}, "options": {"type": "array", "minItems": 1, "items": {"$ref": "#/$defs/progressionChoiceOption"}}}, "additionalProperties": false},
    "progressionChoiceOption": {"type": "object", "required": ["id", "label", "grants"], "properties": {"id": {"type": "string", "minLength": 1}, "label": {"type": "string", "minLength": 1}, "description": {"type": "string"}, "grants": {"type": "array", "minItems": 1, "uniqueItems": true, "items": {"type": "string", "minLength": 1}}, "replaces": {"type": "array", "uniqueItems": true, "items": {"type": "string", "minLength": 1}}}, "additionalProperties": false},
    "mechanicEnvelope": {"type": "object", "required": ["kind", "config"], "properties": {"id": {"type": "string"}, "kind": {"type": "string", "minLength": 1}, "config": {"type": "object"}}, "additionalProperties": false}
  }
}
