{"$schema":"https://simplevtt.local/schemas/content-entry.schema.json","id":"subclass.spellblade","category":"subclass","presentation":{"originalName":"Spellblade","defaultLocale":"ko-KR","locales":{"ko-KR":{"name":"주문검사","summary":"외부 모듈이 기존 클래스에 서브클래스 선택지를 추가하는 예시입니다.","keywords":["서브클래스","홈브류"]}},"translationSource":{"repository":"example.homebrew","path":"subclasses/spellblade.json","status":"draft"}},"requiresCapabilities":["dnd.content.cross-module-contribution.v1"],"relationships":[{"kind":"parent","target":"dnd.srd-5.2.1.core/class.fighter"},{"kind":"extends","target":"dnd.srd-5.2.1.core/class.fighter","extensionPoint":"class:fighter:subclass-options"}],"progressionContributions":[{"track":"progression.class.fighter.level","threshold":3,"grants":["feature.spellblade.example"]}],"mechanics":[]}
